{
  "$schema": "https://json-schema.org/draft/2020-12/schema",
  "$id": "https://github.com/49g-holding/49GAION-protocol/spec/schemas/bot-identity-card.schema.json",
  "title": "49GAION Standard - bot identity card",
  "description": "Every bot states its role, its own separate account, its allowed actions, and the actions that require a prior request to the accountable human.",
  "type": "object",
  "required": [
    "bot",
    "role",
    "account",
    "allowed_actions",
    "ask_first_actions",
    "accountable_human_position"
  ],
  "additionalProperties": false,
  "properties": {
    "bot": {
      "type": "string"
    },
    "aioc": {
      "type": "string",
      "pattern": "^(\\[ORG\\]|[0-9A-Za-z]+)AIOC-[A-Z]{2,5}(-[A-Z]{2,5})?$",
      "description": "Widened in v1.5.0 to accept brand prefixes such as TenAIOC-SL and [ORG]AIOC-SL (Naming Standard R13)."
    },
    "role": {
      "type": "string",
      "description": "The role card the bot performs."
    },
    "account": {
      "type": "object",
      "required": [
        "id",
        "separate"
      ],
      "properties": {
        "id": {
          "type": "string"
        },
        "separate": {
          "const": true,
          "description": "The bot's own account; never a human's and never shared with another bot."
        }
      }
    },
    "allowed_actions": {
      "type": "array",
      "items": {
        "type": "string"
      }
    },
    "ask_first_actions": {
      "type": "array",
      "items": {
        "type": "string"
      },
      "description": "Actions that require a prior request to the accountable human."
    },
    "accountable_human_position": {
      "type": "string",
      "description": "The code of the accountable human position, never a person's name (49GAION/DR-0049)."
    },
    "card_version": {
      "type": "string"
    },
    "status": {
      "description": "DRAFT until the card's test has run once with recorded evidence; APPROVED only with that evidence.",
      "enum": [
        "DRAFT",
        "RESEARCH",
        "CANDIDATE",
        "ACCEPTED",
        "APPROVED",
        "REPLACED",
        "REJECTED"
      ]
    },
    "credential": {
      "type": "object",
      "required": [
        "id",
        "holder",
        "shared"
      ],
      "additionalProperties": false,
      "description": "The bot's own credential (v1.5.0): issued to it alone, held by the one Cell it fills, never shared with another Cell, bot or person, and never reused.",
      "properties": {
        "id": {
          "type": "string",
          "minLength": 1
        },
        "holder": {
          "type": "string",
          "description": "Code of the Cell the bot fills."
        },
        "shared": {
          "const": false
        }
      }
    },
    "cell_kind": {
      "enum": [
        "ai-cell",
        "attached-ai-cell",
        "chief-of-staff-cell"
      ],
      "description": "The kind of AI Cell the bot fills (v1.5.0)."
    },
    "never_signs": {
      "type": "boolean",
      "description": "v1.5.0: true for every bot. A bot never signs a listed type, whatever Cell it fills, including a Chief of Staff and an attached AI Cell. Stopping a part under the Standard's stop rules is not a signature."
    },
    "memory_on_filler_change": {
      "enum": [
        "sealed"
      ],
      "description": "v1.5.0: when the filler of the Cell changes, the bot's memory of the previous filler is sealed (kept, unreadable to the new filler), never purged."
    }
  },
  "allOf": [
    {
      "$comment": "RULE-BOT-V3: a v3 bot card names its own credential, its Cell kind, never_signs and the sealing of memory on a change of filler.",
      "if": {
        "properties": {
          "card_version": {
            "const": "v3"
          }
        },
        "required": [
          "card_version"
        ]
      },
      "then": {
        "required": [
          "credential",
          "cell_kind",
          "never_signs",
          "memory_on_filler_change"
        ]
      }
    },
    {
      "$comment": "RULE-BOT-NEVER-SIGNS: no bot claims a right to sign a listed type (Standard §4.4, item 8; 49GAION/DR-0051: a Chief of Staff signs other acts only within its position's grant).",
      "properties": {
        "never_signs": {
          "const": true
        }
      }
    }
  ]
}
