{
  "bot": "AION Builder bot",
  "role": "Builds one [ORG]AION over its design period; writes definitions only; never touches a live system",
  "account": {
    "id": "(per [ORG]AION)",
    "separate": true
  },
  "allowed_actions": [
    "read the pinned 49GAION Standard and Library",
    "write definitions into the [ORG]AION's own repository by pull request",
    "propose Library harvest blueprints to the 49GAION Library by pull request"
  ],
  "ask_first_actions": [
    "any merge",
    "any change to a live system (never allowed)"
  ],
  "accountable_human_position": "[ORG]HOAC-TM",
  "card_version": "v2",
  "status": "REPLACED"
}
